Judul,Berita,Topik
PLN dan PTBA Kerja Sama Pemanfaatan Sisa Hasil Pembakaran Batu Bara,"JAKARTA, KOMPAS.com - PT Bukit Asam Tbk (PTBA) dan PT PLN (Persero) melalui subholding PLN Nusantara Power (PLN NP) menandatangani Nota Kesepemahaman Pemanfaatan Fly Ash Bottom Ash (FABA) sebagai material penetralisir air asam tambang (NAF). 
 Kesepakatan tersebut ditandatangani Direktur Operasi & Produksi PT Bukit Asam Tbk (PTBA) Suhedi dengan Direktur Operasi Pembangkit Batubara PLN NP Rahmanoe Indarto pada Konferensi Perubahan Iklim Perserikatan Bangsa-Bangsa 2023 atau COP 28 di Dubai, Kamis (30/11/2023).
 Penandatanganan Nota Kesepahaman disaksikan oleh Menteri Koordinator Bidang Kemaritiman dan Investasi (Menko Marves) Ad Interim Erick Thohir, Direktur Utama PT PLN (Persero) Darmawan Prasodjo dan Direktur Utama PT Bukit Asam Tbk (PTBA) Arsal Ismail. 
KOMPAS.com/Isna Rifka Sri Rahayu Menteri BUMN sekaligus Menteri Koordinator Bidang Kemaritiman dan Investasi Ad Interim Erick Thohir  saat ditemui di Gedung Kementerian BUMN, Jakarta, Kamis (23/11/2023).
""Saya ingin mengucapkan terima kasih kepada semua pihak yang telah berkomitmen kuat untuk bekerja sama, dan memberikan kontribusi bagi Indonesia yang lebih ramah lingkungan,"" kata Erick dalam keterangan tertulis, Sabtu (2/12/2023).
 Direktur Utama PLN Darmawan Prasodjo mengatakan, FABA yang selama ini merupakan bahan sisa dimanfaatkan oleh PLN menjadi salah satu sumber bahan baku alternatif. 
 Hal ini, kata dia, sejalan dengan nilai Environmental, Social, and Governance (ESG) yang menjadi komitmen global dalam meningkatkan kesejahteraan ekonomi masyarakat sekaligus menjaga lingkungan.
 ""Sebagai BUMN, kami menyadari betul betapa pentingnya setiap pelaku usaha, terutama industri mempunyai visi yang sama dalam menjaga lingkungan yang berkelanjutan. Sinergi akan terus kami tingkatkan untuk bisa mendukung upaya pemerintah dalam menjaga lingkungan demi masa depan yang lebih baik untuk generasi selanjutnya,"" kata Darmawan.














",MONEY
Link Arm Rusak Bisa Diperbaiki Biar Lebih Hemat,"KLATEN, KOMPAS.com - Perbaikan kaki-kaki atau suspensi mobil kerap dianggap mahal oleh sebagian orang.
Namun, bila perbaikan tidak dilakukan dengan menggantinya dalam jumlah besar, maka biaya yang dikeluarkan tidak akan terlalu mahal.
Seperti perbaikan link arm, bisa saja mahal bila perbaikan dilakukan dengan menggantinya secara menyeluruh, tapi akan lain soal jika hanya sebagian kecil pada onderdil yang rusaknya saja. Biayanya akan jauh lebih hemat.
Faktanya, perbaikan link arm bisa dilakukan secara parsial yakni dengan mengganti komponen rusaknya saja seperti yang dilakukan di bengkel spesialis berikut ini.
Kompas.com/Erwin Setiawan Link arm menjadi salah satu komponen pemegang roda agar bisa berdiri tegap
Mekanik Aha Motor Spesialis Nissan & Datsun Yogyakarta Amirul Ilham mengatakan, perbaikan link arm bisa dikelompokkan dalam tiga bagian, menyesuaikan dengan jenis kerusakannya.
“Perlu diperiksa dulu seperti apa kerusakannya, jika kerusakan tersebut merupakan bagian dari lempengan baja, bengkok atau sejenisnya, maka solusinya harus diganti,” ucap Ilham kepada Kompas.com, beberapa waktu lalu.
Menurutnya, lempengan link arm bila sudah bengkok akan sulit dikembalikan seperti bentuk semula. Sehingga bila bagian ini kena, maka mau tidak mau perbaikan yang disarankan satu set.
Kompas.com/Adityo Suspensi belakang Mitsubishi XForce
“Risikonya akan mengubah sudut roda, sehingga meski spooring tidak akan mampu mengatasi link arm yang bengkok, maka dari itu harus diganti agar aman dan nyaman” ucap Ilham.
Kecuali, kerusakannya bukan pada lempengan baja, Ilham mengatakan masih bisa diperbaiki pada bagian-bagian kecilnya.
“Link arm terdiri dari lempengan baja, ball joint, dan karet pengikat atau bushing, untuk menekan bujet perbaikan biasanya bushing atau ball join yang diganti, ini bagian yang sering oblak,” ucap Ilham.














",OTOMOTIF
"Piala Dunia U17 2023: Kebanggaan Mali, Masa Depan Cerah Menanti ","KOMPAS.com - Meraih peringkat ketiga Piala Dunia U17 2023 menjadi kebanggaan timnas Mali. Masa depan cerah pun menanti skuad berjuluk Les Aigles itu. 
Mali mendapatkan medali perunggu Piala Dunia U17 2023 usai mengalahkan Argentina 3-0 di Stadion Manahan, Solo, Jawa Tengah, Jumat (1/12/2023). 
Gol-gol kemenangan Mali tercipta berkat aksi Ibrahim Diarra, Mamadou Doumbia, dan Hamidou Makalou. 
Meski bukan gelar juara, keberhasilan membawa pulang medali perunggu sudah menjadi suatu kebanggaan bagi skuad Les Aigles. 
""Saya bangga, kami sudah siap untuk memenangkannya, tetapi itu bukan rencana Tuhan,"" kata pelatih timnas U17 Mali, Soumaila Coulibaly, dikutip dari laman FIFA. 
""Kami kalah di semifinal, tetapi kami tidak kalah dalam pertarungan. Tim bermain dengan baik dan layak mendapatkan medali mereka. Saya sangat bangga dan sangat senang,"" ujar dia. 
Kapten Mali, Ibrahim Diarra, mengungkapkan bahwa ""mantra"" sang pelatih membuat timnya termotivasi untuk mengalahkan Argentina dan memenangkan perunggu. 
""Para pelatih mengatakan kepada kami bahwa turnamen kami belum berakhir dan masih ada satu pertandingan lagi. Kami mendengarkan mereka dan itu berhasil,"" ujar Diarra.
""Sekarang kami akan pulang dengan membawa medali. Ini adalah hadiah yang tulus bagi kami dan sangat menyenangkan,"" ucap pemain berusia 16 tahun tersebut. 
Masa depan cerah pun menanti para pemain Mali. Mereka menjadi salah satu tim yang lolos ke Olimpiade Paris 2024. 
Soumaila Coulibaly berharap pelatih timnas U23 Mali, Aliou Badra Diallo, akan membawa beberapa pemain U17. 
""Ya, saya yakin saya memiliki pemain yang akan berada di sana, karena mereka punya pengalaman bagus di Piala Dunia,"" kata Coulibaly.
""Masih ada delapan, sembilan bulan lagi, jadi mereka punya waktu untuk mempersiapkan diri,"" ungkapnya melanjutkan. 














",BOLA
9 Tempat Wisata di PIK 2 buat Liburan Akhir Tahun ,"KOMPAS.com - Kawasan Pantai Indah Kapuk (PIK) 2 menjadi primadona baru wisata Jakarta dan sekitarnya. Masyarakat bisa mengunjungi beragam destinasi wisata di PIK saat liburan akhir tahun 2023. 
Selain pantai, ada beragam destinasi wisata menarik di PIK 2. Mulai dari pantai pasir putih, wisata kuliner, toko buku estetik, dan spot foto Instagramable. 
Berikut rekomendasi wisata di PIK 2 buat liburan akhir tahun 2023. 
KOMPAS.com/FAQIHAH MUHARROROH ITSNAINI Salah satu pintu masuk East Coast By The Sea di Golf Island PIK. 
East Coast By The Sea merupakan destinasi baru untuk para pencinta kuliner. Berlokasi di Golf Island PIK, destinasi kuliner ini hadir dalam konsep desain alfresco dining, atau makan di ruang terbuka, dengan pilihan kuliner yang beragam, dikutip dari Kompas.com, Jumat (13/1/2023).
Tempat makan di area East Coast By The Sea menempati lahan seluas 9.400 meter persegi. Pengunjung bisa masuk dari tiga pintu utama.
Destinasi ini merupakan tempat kuliner berkonsep rustic-tropical pertama yang hadir di Pantai Indah Kapuk. Inspirasi East Coast By The Sea berasal dari pantai di Karibia, Meksiko, dan Bali. 
Pengunjung bisa menikmati aneka masakan lokal hingga internasional. Adapun biaya makanan berat berkisar Rp 100.000-Rp 200.000-an, sedangkan minuman dan camilan mulai Rp 25.000-Rp 100.000-an.
SHUTTERSTOCK/ANDREAS H Pantjoran PIK.
Destinasi wisata kuliner lainnya adalah Pantjoran PIK. Ciri khas Pantjoran PIK adalah bernuansa Tionghoa, dengan dominasi ornamen dan bangunan warna merah.
Pengunjung langsung disambut dengan bangunan bergaya khas Tionghoa, sehingga suasananya seperti di China. Adapula beragam spot foto instagramable yang didominasi warna merah khas Tionghoa. 
Lokasinya ada di kawasan Golf Island PIK, Pantjoran PIK, Jakarta Utara.
Berkunjung ke kawasan PIK 2 tidak lengkap tanpa bermain di area pantai pasir putih. Meski masuk Kabupaten Tangerang, namun pantai ini terletak tidak jauh dari ibu kota. 
Wisatawan bisa menikmati hamparan pasir putih sembari bersantai bersama keluarga. Adapula area foodcourt yang bisa dikunjungi wisatawan. Pantai pasir putih juga berdekatan dengan sejumlah destinasi hits lain di PIK 2. 
DOK COVE AT BATAVIA PIK Cove at Batavia PIK, destinasi ruang terbuka di kawasan Jakarta Utara.
Cove at Batavia masuk dalam daftar destinasi yang wajib kamu kunjungi saat bewisata di PIK 2. Mengutip Kompas.com (5/7/2022), Cove at Batavia menawarkan beragam tempat kuliner dengan pemadangan tepi laut. 
Berada di atas lahan seluas 1,5 hektare, kawasan wisata ini dilengkapi dengan jembatan cantik dan panggung pertunjukan, membuat suasananya terasa romantis seperti di Venezia. 
Alamatnya ada di Jalan Pantai Indah Kapuk Nomor 1, Kamal Muara, Penjaringan, Jakarta Utara.
Sebuah kiriman dibagikan oleh Kompas Travel (@kompas.travel)














",TRAVEL
Unkris dan UTM Gelar Seminar Internasional untuk Tingkatkan Kualitas Jurnal Ilmiah,"KOMPAS.com - Universitas Krisnadwipayana (Unkris) dan University of Technology of Malaysia (UTM) menggelar seminar internasional “Navigating the World of Academic Journal: Writing and publishing” secara hibrid pada Sabtu, 25 November 2023.
Seminar diikuti lebih dari 250 peserta berasal dari kalangan dosen, mahasiswa pascasarjana, baik dari Unkris maupun perguruan tinggi lain dari dalam dan luar negeri.
Seminar internasional Unkris dan UTM menghadirkandua pembicara utama Assc. Prof. Assnul Dahar bin Minghat (UTM) dan Prof. Ace Suryadi (UPI) dengan moderator Donny Abdul Latief Poespowidjojo (Unkris).
Rektor Unkris Ayub Muktiono dalam sambutan mengatakan, Unkris memiliki visi menjadi universitas unggul pada 2025. Untuk mencapai visi tersebut berbagai upaya telah dan akan terus dilakukan oleh Unkris.
""Salah satunya adalah meningkatkan kualitas karya ilmiah yang dihasilkan oleh dosen dan mahasiswa Unkris. Karya ilmiah berkualitas yang dimaksud adalah yang dapat diterima jurnal internasional yang berkualitas dan terakreditasi,"" ungkap Ayub Muktiono.
“Seminar internasional ini menjadi bagian dari upaya Unkris memacu dosen dan mahasiswa untuk bagaimana menghasilkan karya ilmiah yang bisa terbit di jurnal internasional terakreditasi,” tambah Rektor Unkris.
Ia berharap melalui materi yang disampaikan dua pembicara tersebut dapat menambah wawasan dosen dan mahasiswa, juga akademisi yang mengikuti seminar internasional, terkait bagaimana bisa menembus jurnal internasional terakreditasi.
Ketua Penyelenggara Seminar Internasional, Dhistianti Mei Rahmawantari menjelaskan, tujuan seminar internasional ini antara lain meningkatkan kualitas artikel yang dihasilkan akademisi Unkris khususnya dan di Indonesia pada umumnya.
""Terutama para mahasiswa pascasarjana yang membutuhkan bimbingan dan masukan mengenai bagaimana menulis dan menerbitkan artikel yang berkualitas, dan secara online adalah para akademisi dari berbagai macam daerah termasuk mancanegara,"" jelasnya.
Dhistianti menyampaikan, dalam menulis artikel ilmiah berkualitas diperlukan hasil temuan yang mendalam dan berdampak kepada masyarakat maupun akademis, literatur review yang update, dan analisis kritis.














",EDUKASI
KPU Diminta Konsisten Jalankan Aturan Debat Capres-Cawapres,"Titi menjelaskan bahwa debat kandidat Pemilihan Presiden (Pilpres) diatur di dalam Pasal 277 Ayat (1) Undang-Undang Nomor 7 Tahun 2017 tentang Pemilihan Umum.
Selain itu, agenda debat tersebut juga diatur di dalam Peraturan KPU (PKPU) Nomor 15 Tahun 2023 tentang Kampanye Pemilihan Umum.
Dua aturan ini mengatur debat pasangan calon (paslon) pilpres berlangsung lima kali.
""Meliputi tiga kali debat capres dan dua kali debat cawapres. Dengan demikian, mestinya KPU konsisten saja melaksanakan apa yang sudah menjadi ketentuan,"" kata Titi kepada Kompas.com, Sabtu (2/12/2023).
KPU sejauh ini telah mengatur format debat paslon capres dan cawapres diselenggarakan lima kali. Hanya saja, dalam lima debat tersebut, capres dan cawapres sama-sama naik panggung.
Perbedaannya hanya terdapat pada proporsi bicara masing-masing capres dan cawapres, tergantung agenda debat hari itu, apakah debat capres atau debat cawapres.
Titi menuturkan, meskipun capres diminta hadir, namun debat tersebut seharusnya berlangsung antara cawapres dan tidak melibatkan capres untuk menjawab.
Titi menggarisbawahi, penyampaian visi, misi, dan program bisa dilakukan bersama. Akan tetapi, debat tetap harus hanya diikuti oleh cawapres dalam konteks debat antar-cawapres.
Di sisi lain, Titi menilai format debat yang diatur dalam UU Pemilu tidak menarik. Sebab, dalam pelaksanaannya tidak membuka ruang dialog antara kandidat dan moderator atau audiens.
Bahkan UU Pemilu menyebut selama dan sesudah berlangsungnya debat paslon, moderator dilarang memberikan komentar, penilaian, dan simpulan apa pun terhadap penyampaian dan materi dari setiap paslon.
""Sehingga memang tidak banyak ruang gerak yang bisa dilakukan selain berfokus pada pertanyaan yang sudah disiapkan panelis,"" ujar dia.
Titi menyarankan agar mekansime debat di Pilpres 2024 bisa dikembangkan dengan memberi kesempatan pendalaman kepada para panelis.
Bahkan, untuk ketepatan dalam pembahasan isu, panelis diharapkan bisa berasal dari pihak-pihak yang terdampak langsung dengan tema yang menjadi pembahasan debat.
""Misalnya untuk tambang, bisa saja panelisnya dari warga yang berada dan terdampak oleh industri pertambangan. Panelis tidak harus berasal dari akademisi. Terpenting ada ruang untuk pendalaman,"" katanya.














",NEWS
Pria Hendak Masturbasi di Transjakarta Tak Dilaporkan karena Diduga Berkebutuhan Khusus,"JAKARTA, KOMPAS.com - Sekuriti Transjakarta tidak melaporkan pria berinisial KB (23) yang disebut hendak masturbasi di dalam bus karena menduga pelaku merupakan orang berkebutuhan khusus.
Kapolsek Mampang Prapatan Kompol David Y Kanitero berujar, KB sempat ditangkap sekuriti di Halte Tendean usai menumpangi bus Transjakarta rute Puri Beta-Latuharhary, Kamis (30/11/2023).
""Oleh sekuriti, karena dirasa orang tersebut berkebutuhan khusus langsung dipulangkan. Kemudian dengan diimbau supaya tidak naik bus Transjakarta lagi,"" kata David saat dihubungi Kompas.com, Sabtu (2/12/2023).
Peristiwa itu diketahui setelah pemilik akun Twitter @DellanyM mengunggah postingan bahwa KB hendak masturbasi di dalam bus.
Pelaku juga sempat memegang alat kelaminnya sambil melihat ke arah korban.
""Tolong @PT_Transjakarta, orang ini baru aja nyoba masturbasi di TJ L13E Puri Beta-Latuharhari kode bis MYS-17024 sekitar jam 08:15 pagi ini. Pindah posisi ke depan gue (berdiri), ngeliatin gue enggak putus sambil posisi tangan di kelamin, abis gue teriakin dia mundur lagi ke belakang,"" tulis pemilik akun @DellanyM dikutip Kompas.com.
Seusai melihat unggahan tersebut, pihak PT Transjakarta menelusuri keberadaan pelaku berinisial KB (23). Pelaku kemudian diamankan di Halte Tendean.
""Pada saat diamankan oleh sekuriti, setelah anggota cek memang diamankannya di Halte Tendean. Tetapi tidak dilaporkan oleh sekuriti ke kepolisian,"" ungkap David.
Belakangan diketahu, pelaku merupakan warga Jepara, Jawa Tengah. Namun, kepolisian tak mengetahui domisili KB saat ini.
""Karena sama sekuriti juga langsung dipulangkan, sekuriti tidak mencatat alamatnya di Jakarta. Kalau sesuai dengan alamat KTP, dia di luar jakarta,"" jelas David.
Dia lantas meminta agar petugas bisa melapor bila kejadian serupa kembali terjadi.
""Imbauan kami ke petugas sekuriti supaya kalau ada kejadian seperti itu lagi dilaporkan kepada kami, pihak kepolisian. Kemudian kami bisa berkomunikasi ke Dinas Sosial,"" tutur dia.














",NEWS
"Bagikan Koin Menhan ke Anak-anak di Tasikmalaya, Prabowo: Kalau Sudah Besar, Ingat Saya Pernah ke Sini","TASIKMALAYA, KOMPAS.com - Calon presiden (capres) nomor urut 2 Prabowo Subianto membagikan koin Menteri Pertahanan (Menhan) saat berkampanye di Pondok Pesantren (Ponpes) Miftahul Huda di Tasikmalaya, Jawa Barat, Sabtu (2/12/2023).
Pantauan Kompas.com di Ponpes Miftahul Huda, Prabowo membagi-bagikan koin tersebut usai menyapa ribuan santri di ponpes.
Dia menemui sejumlah anak yang sedang bermain di lingkungan ponpes.
Lalu, Prabowo memeluk mereka dan menanyakan nama serta umur masing-masing.
Prabowo pun berpesan kepada anak-anak untuk belajar dengan rajin.
""Kamu namanya siapa? Ami? Umurnya berapa? 6,5 (tahun), oh. Nanti belajar yang rajin, ya,"" ujar Prabowo.
""Kamu siapa? Ferdi. Kamu? Rafiq. Kamu? Idhwan. Umurmu berapa? 7. Belajar yang baik, ya. Terima kasih,"" sambung dia.
Kemudian, Prabowo mengatakan kepada anak-anak tersebut bahwa dirinya ingin memberikan kenang-kenangan.
Ajudan yang kerap berada di sampingnya, Mayor Teddy, dengan sigap mengambil sejumlah koin untuk diberikan ke Prabowo.
Koin Menhan tersebut berwarna emas.
Prabowo meminta anak-anak itu untuk menyimpan koin Menhan pemberiannya sebagai kenang-kenangan.
""Nanti kalau kamu besar, kau ingat ya, Menteri Pertahanan pernah datang ke sini,"" ucap Prabowo.
""Kamu siapa namanya? Ical. Lho, mana giginya (ompong) ha ha ha,"" katanya sambil tertawa.














",NEWS
AirAsia Tunda Pindah Penerbangan Domestik ke Terminal 2 Bandara Soekarno-Hatta,"KOMPAS.com - Maskapai Indonesia AirAsia menunda rencana relokasi seluruh penerbangan domestik ke Terminal 2 Bandara Internasional Soekarno-Hatta (CGK) di Tangerang, Banten, yang sebelumnya dijadwalkan pada Rabu (6/12/2023).
Saat ini, seluruh penerbangan domestik AirAsia masih beroperasi di Terminal 1A Bandara Internasional Soekarno-Hatta. 
""Penundaan ini kami lakukan untuk memastikan kesiapan dan kenyamanan dalam memberikan pengalaman perjalanan yang terbaik kepada seluruh penumpang Indonesia AirAsia yang melakukan rute perjalanan domestik,"" kata Direktur Operasi Indonesia AirAsia, Capt. Wuri Septiawan dalam keterangannya, Sabtu (2/12/2023). 
Capt. Wuri menambahkan, penundaan rencana relokasi ini juga dilakukan guna menjaga kualitas pelayanan Indonesia AirAsia.
Tidak hanya itu, penundaan ini juga demi menjaga kepercayaan penumpang yang kerap melakukan perjalanan domestik melalui bandara tersebut.
SHUTTERSTOCK/ABAH BARATAWIRIA Ilustrasi pesawat milik AirAsia Indonesia di Bandara Internasional Soekarno-Hatta. 
""Indonesia AirAsia menyarankan seluruh calon penumpang dapat memeriksa email dan SMS untuk mendapatkan notifikasi terkait dengan jadwal penerbangan,"" kata Wuri. 
""Serta check-in dan mencetak kembali boarding pass-nya melalui aplikasi airasia MOVE (dahulu airasia SuperApp) atau situs web airasia.com,"" sambungnya. 
Untuk informasi terkait lokasi dan pilihan transportasi dari dan menuju Terminal 1A, calon pelaku perjalanan bisa mengecek situs web Bandara Internasional Soekarno-Hatta.
Adapun tiket penerbangan dapat dipesan melalui aplikasi airasia MOVE, situs web AirAsia, biro perjalanan daring dan agen penjualan tiket resmi lainnya.
Sementara itu, pemesanan tiket rombongan berjumlah 10 orang atau lebih bisa dilakukan dengan menghubungi layanan Group Desk AirAsia melalui email ke groupbooking_id@airasia.com.
 














",TRAVEL
"Data Analyst Jadi Profesi Paling Dibutuhkan, Ini Rekomendasi Jurusan Kuliahnya","KOMPAS.com - Pekerjaan paling bersinar di masa depan menurut World Economic Forum atau WEF 2023 salah satunya adalah data analyst. WEF memprediksi, pekerjaan ini banyak membuka peluang kerja sampai tahun 2030.
Secara garis besar, pekerjaan data analyst adalah menganalisa data yang dimiliki perusahaan. Melansir Universitas Multimedia Nusantara, data analyst adalah profesi yang tugasnya membaca serta menganalisis data yang ada dari perusahaan dalam rangka keberlangsungan perusahaan tersebut.
Di era digitalisasi seperti sekarang, profesi terkait pengolahan data sangat menjamur dan dibutuhkan oleh perusahaan-perusahaan. Selain data analyst ada juga data engineer dan data scientist.
Di Indonesia sendiri sudah banyak kampus yang memiliki jurusan kuliah yang lulusannya dapat berkarier di bidang pekerjaan ini.
Berikut jurusan kuliah pilihan untuk daftar tahun 2024 untuk siswa yang ingin menjadi data analyst.
1. Ilmu komputer
Ada banyak Perguruan Tinggi Negeri (PTN) yang punya jurusan Ilmu Komputer. Misalnya, Institut Teknologi Bandung (ITB), Institut Teknologi Sepuluh Nopember (ITS), Universitas Brawijaya (UB) dan masih banyak lagi.
2. Jurusan Teknik Informatika
Lulusan jurusan ini juga bisa menjadi salah satu jurusan yang berkaitan dengan data analyst.
Jurusan ini menangani masalah transformasi atau pengelolaan data dengan proses logika. Karen itu skill-nya cocok dengan pekerjaan ini.














",EDUKASI
"Lansia di Makassar Meninggal Usai Terapi Air Laut, Diduga Terkena Serangan Jantung","Pria berusia 65 tahun itu tewas diduga lantaran terkena serangan jantung saat berendam. SD dinyatakan meninggal dunia dalam perjalanan menuju rumah sakit.
Kapolsek Tamalate AKP Aris Sumarsono membenarkan perihal peristiwa nahas yang dialami pria lanjut usia (Lansia) itu. Kata dia, peristiwa itu terjadi saat SD bersama rombongan tengah melakukan terapi kesehatan rutin.
""Mereka ini rombongan (melakukan) terapi sekitar jam 06.00 Wita, terus merendam pake pelampung,"" jelas Aris saat dikonfirmasi awak media, Sabtu siang.
Kata Aris, saat berendam SD tak sadarkan diri. Rekan SD pun panik dan langsung mengevakuasi SD ke tepi pantai.
""Ini temannya curiga, karena setelah (disentuh) tidak menyahut dan ternyata tidak sadarkan diri. Jadi setelah itu ditarik ke atas,"" ucapnya.
SD yang diketahui merupakan pensiun pegawai BUMN ini pun langsung dilarikan ke rumah sakit (RS) terdekat untuk mendapatkan pertolongan.
Namun, saat dalam perjalanan SD sudah dinyatakan meninggal dunia. Keluarga pun langsung membawa jasad SD ke rumah duka untuk semayamkan.
""(Keluarga) tidak keberatan karena masih dianggap wajar. Tidak mau diautopsi dan dibawah pulang. Korban (SD) ini sakit jantung, bukan tenggelam, merendam badannya, kambuh penyakitnya,"" tandasnya.
Berdasarkan informasi, SD memang sudah lama memiliki riwayat penyakit jantung dan baru sekitar satu bulan menjalani terapi kesehatan air laut.














",REGIONAL
4 Cara Simpan Kentang Kupas agar Tidak Berubah Kecoklatan,"KOMPAS.com - Kentang kupas mirip dengan apel. Dapat berubah warna bila dibiarkan terlalu lama setelah dipotong-potong.
Sebenarnya, perubahan warna kentang kupas menjadi kecoklatan tidak memengaruhi proses masaknya, tetapi tampilannya tentu berbeda.
Hindari perubahan warna pada kentang kupas dan potong dengan melakukan tips yang dilansir dari Southern Living berikut ini.
Jangan menyetok kentang. Sengaja mengupasnya dalam jumlah banyak, lalu membiarkannya di suhu ruang.
Hal ini akan membuat kentang berubah kecoklatan sebelum dimasak sehingga dinilai tidak efektif.
Sebaiknya, kupas kentang ketika ingin memasak untuk menghindari perubahan warna pada bahan makanan ini.
PIXABAY/ Christos Giakkas Ilustrasi kentang kupas
Setelah mengupas dan memotong kentang, masukkan ke dalam air es.
Cara ini dapat mencegah kentang kupas kecoklatan, bahkan hingga satu hari setelahnya bila disimpan di lemari es.
Bahan asam, seperti cuka dan jus lemon, dapat menghambat perubahan warna kentang menjadi kecoklatan.
Teteskan jus lemon atau cuka secukupnya ke dalam rendaman kentang setelah dikupas dan dipotong
Jenis bahan dari wadah yang digunakan juga bisa memengaruhi perubahan warna pada kentang.
Kamu bisa menggunakan wadah kaca sebagai pilihan tepat untuk merendam kentang kupas.
Wadah berbahan logam justru akan mempercepat perubahan warna kentang kupas menjadi kecoklatan.














",FOOD
"BPOM Ungkap Kosmetik Ilegal yang Mengandung Merkuri, Ini Bahayanya pada Kesehatan","Berdasarkan hasil patroli siber pada Januari-September 2023, terdapat lima kosmetik berbahaya dan ilegal yang masih beredar di marketplace.
""Terhadap temuan ini ditindaklanjuti dengan mengajukan permohonan penutupan atau pemblokiran website ke Kementerian Komunikasi dan Informatika, serta suspend toko online kepada marketplace,"" kata BPOM dikutip dari Kompas.com, Senin (27/11/2023).
Temuan kosmetik berbahaya ini adalah hasil pengawasan BPOM secara daring sesuai dengan Peraturan BPOM Nomor 8 Tahun 2020 tentang Pengawasan Obat dan Makanan yang Diedarkan secara Daring sebagaimana telah diubah dengan Peraturan BPOM Nomor 32 Tahun 2020.
Adanya temukan tersebut, BPOM memastikan akan menarik peredaran serta memusnahkan produk kosmetik yang mengandung bahan berbahaya tersebut.
Lantas, apa bahaya merkuri yang terkandung dalam kosmetik?

Dokter spesialis kulit dari Vivaldy Skin Clinic sekaligus dosen di Fakultas Kedokteran Universitas Mataram, Dedianto Hidajat mengatakan, penggunaan merkuri pada kosmetik dapat menyebabkan beberapa kondisi serius.
Merkuri sendiri adalah salah satu jenis logam berat yang berbahaya yang sebaiknya dijauhkan dari tubuh.
Selain itu, merkuri juga tergolong toksik, tahan urai, dan dapat terakumulasi di dalam tubuh.
""Efek merkuri pada kulit ada 2, yaitu yang segera terjadi dan yang kronis atau pada penggunaan jangka panjang,"" ujarnya kepada Kompas.com, Selasa (28/11/2023).
Dedi melanjutkan, efek merkuri pada kulit yang bisa terlihat dalam jangka pendek yakni membuat kulit cepat menjadi putih. Namun, putih yang dihasilkan tidaklah natural, melainkan tampak seperti pucat.
Kemudian, pada efek jangka panjangnya dapat menimbulkan ruam kemerahan, kulit mudah terkelupas, mudah iritasi, sensitif, serta membuat kulit menipis.
Dedi menyampaikan, saat seseorang menggunakan produk yang mengandung merkuri meski hanya sebentar, maka penggunanya masih bisa mengalami efek samping tersebut.
""Penggunaan jangka pendek pun masih bisa mengalami efek samping tersebut, meskipun efeknya tidak spesifik. Ini karena merkuri bisa terserap ke dalam organ dalam tubuh,"" terangnya.
wikimedia.org Merkuri yang berwujud cair














",TREN
