Judul,Berita,Topik
"Bakteri: Pengertian, Struktur, dan Klasifikasinya","KOMPAS.com - Bakteri merupakan organisme hidup bersel tunggal yang memiliki ukuran sangat kecil.
Diketahui terdapat banyak sekali bakteri yang tersebar di dunia, termasuk yang ada di dalam dan di tubuh manusia.
Mereka ada di kulit, saluran pernapasan, dan mulut. Mereka juga ada di sistem pencernaan, sistem reproduksi, bahkan saluran kemih Anda.
Bakteri cenderung dikenal sebagai penyebab dari berbagai macam penyakit. Namun, sebagian dari mereka juga membentuk mikrobioma dan menjaga kesehatan tubuh manusia.

Dilansir dari laman National Human Genome Research Institute NIH, bakteri adalah organisme mikroskopis bersel tunggal.
Bakteri tidak mempunyai inti sehingga tergolong prokariotik. Mereka adalah mikroba dengan struktur sel yang sangat sederhana.
Bakteri ditemukan hampir di semua tempat di bumi dan termasuk bagian yang sangat penting bagi ekosistem planet ini.
Tubuh manusia penuh dengan bakteri, dan bahkan diperkirakan ada lebih banyak sel bakteri dibandingkan sel manusia.
Ada bakteri jahat yang disebut patogen dan menyebabkan penyakit. Untungnya, Sebagian besar bakteri dalam tubuh manusia tidak berbahaya, dan justru bermanfaat bagi tubuh.
Misalnya dalam sistem pencernaan, khususnya pada usus, manusia memiliki bakteri yang sangat diperlukan untuk membantu tubuh berfungsi secara normal.
Bakteri merupakan mikroorganisme yang bentuknya bermacam-macam. Bentuknya bisa berupa bola, bisa berupa batang, atau bisa juga berbentuk spiral.
Kebanyakan bakteri berkembang biak melalui pembelahan biner. Artinya, setiap sel bakteri menggandakan DNA-nya dan membelah menjadi dua bagian, dengan setiap sel baru menerima satu salinan DNA.
iStockphoto/Vitalii Dumma Ilustrasi struktur bakteri.
Sel bakteri berbeda dengan sel tumbuhan maupun hewan. Bakteri termasuk dalam kategori sel prokariotik, yang berarti mereka tidak memiliki inti.
Dikutip dari laman Medical News Today, struktur sel bakteri meliputi:














",TREN
Generasi Terbaru Mobil Listrik Nissan Leaf Bergaya SUV,"JAKARTA, KOMPAS.com - Generasi terbaru Nissan Leaf dikabarkan sedang dalam tahap pengembangan. Menurut kabar yang beredar, hatchback ini akan berubah menjadi bergaya SUV.
Untuk diketahui, Leaf pertama kali diperkenalkan pada 2009. Mobil listrik ini sudah masuk generasi kedua yang meluncur pada 2017. Tapi, hingga kini, sempat mengalami facelift juga.
Dikutip dari Carscoops.com, Minggu (3/12/2023), generasi ketiga Leaf akan memiliki tampilan yang lebih sporty, mengarah ke crossover. Disebutkan bahwa desainnya terinspirasi dari Ariya.
Dok. Carscoops.com Nissan Chill Out Concept
Sebagian orang menyebutkan bahwa desain pada generasi pertama dan kedua cukup menarik. Tapi, untuk generasi ketiga diyakini akan lebih menarik lagi desainnya.
Platform yang digunakan akan sama seperti Ariya dan Renault Megane E-Tech, yakni CMF-EV. Desainnya diyakini tidak jauh berbeda dengan konsep yang pernah ditampilkan pada 2021, yakni Chill-Out Concept.
Konsep tersebut ditandai dengan panel bodi yang ramping dan mengalir dengan sedikit garis, lipatan, atau tepi yang tidak perlu, sesuatu yang tidak dapat dikatakan tentang banyak mobil yang saat ini dijual.
Dok. Carscoops.com Nissan Chill Out Concept
Mobil ini juga memiliki bagian depan yang didominasi oleh lampu depan LED, bilah lampu LED, dan lencana Nissan yang menyala. Jika Leaf baru terlihat 50 persen lebih ramping dari konsepnya, ini akan menjadi peningkatan yang dramatis dari mobil yang ada saat ini.
Untuk sumber tenaga alias baterainya, generasi ketiga Leaf disebutkan akan dibekali dengan baterai yang canggih. Baterai tersebut diproduksi oleh perusahaan asal China, yakni Envision.
Baterai canggih ini diklaim menawarkan peningkatan kepadatan energi sebesar 30 persen dibandingkan dengan baterai model saat ini, yang secara signifikan akan meningkatkan jarak tempuh.














",OTOMOTIF
"Pasar Smartwatch Tumbuh Lagi, Apple Masih Memimpin","Pertumbuhan itu didorong oleh pengiriman yang kuat di sejumlah pasar, termasuk India dan China. Di India, pertumbuhan jumlah pengiriman smartwatch dipimpin oleh merek kenamaan India, Fire-Bolt.
Dari total persentase pengiriman smartwatch global, 35 persennya dipasarkan di India. Angka ini membuat India sebagai kontributor terbesar pasar smartwatch global selama tiga kuartal terakhir secara berturut-turut.
Sementara itu di China, salah satunya pendorong pasar smartwatch adalah merek Huawei yang mulai bangkit di pasar arloji pintar.
Menurut Counterpoint, Huawei memimpin pertumbuhan pengiriman smartwatch High-level Operating System (HLOS), yaitu smartwatch yang biasanya dibekali spek dan harga tinggi.
Contoh arloji pintar yang dikategorikan HLOS yaitu yang menjalankan Watch OS, Samsung OS atau yang memiliki kemampuan instal aplikasi pihak ketiga.
Pangsa pasar Huawei dalam kategori HLOS memang masih rendah bila dibandingkan dengan Apple dan Samsung. Namun persentase pertumbuhan Huawei pada kuartal III-2023, mengungguli kedua merek tersebut.
Adapun tren pertumbuhan pengiriman smartwatch global ini terbilang menarik mengingat kondisi ekonomi global yang belum stabil. Selain itu, kondisi ini juga berbanding terbalik dengan pasar smartphone yang masih terbilang lesu.
""Di tengah pelambatan ekonomi global, sebagian besar pasar perangkat konsumen seperti smartphone masih stagnan dibanding tahun lalu. Sebaliknya, pasar smartwatch mencatat pertumbuhan selama dua kuartal berturut-turut baik di segmen premium maupun smartwatch murah,"" kata analis Counterpoint, Woojin Son, dikutip KompasTekno dari situs resmi Counterpoint, Senin (4/12/2023).
Meski pertumbuhan smartwatch global kuartal III-2023 didorong oleh Fire-Bolt dan Huawei, secara umum Apple masih memimpin pasar smartwatch dunia. Pada periode tersebut, Apple mencatat peningkatan pengiriman 7 persen dibanding kuartal III-2022.
Menurut Counterpoint, pertumbuhan Apple didorong oleh pengiriman Apple Watch SE generasi kedua. Smartwatch ini diperkenalkan perusahaan pada September tahun lalu bersamaan dengan Watch Series 8 dan Watch Series Ultra.
Counterpoint tak merinci persentase pangsa pasar Apple secara global. Namun bila dirunut berdasarkan kategori HLOS, pangsa pasar Apple kuartal III-2023 adalah sebesar 45 persen.
Samsung membuntuti Apple dengan pangsa pasar 18 persen untuk kategori HLOS. Angkanya turun bila dibandingkan dengan kuartal III-2022, yaitu sebesar 24 persen.
Secara umum pengiriman smartwatch Samsung juga turun sebesar 19 persen. Penyebabnya menurut Counterpoint yaitu menurunnya pengiriman smartwatch Samsung model lama.
Adapun Huawei membukukan kinerja yang signifikan dengan peningkatan pengiriman sampai 56 persen dibanding kuartal III-2022. Pada kategori HLOS, kenaikannya bahkan sampai 122 persen.
Menurut Counterpoint, faktor pendorongnya adalah dirilisnya model baru termasuk Watch 4 dan 4 Pro pada kuartal II-2023 serta Watch GT 4 pada kuartal III-2023. Faktor lainnya yaitu model penjualan paket yang dijual di berbagai saluran penjualan.














",TEKNO
INFOGRAFIK: Hoaks! Prabowo Dinonaktifkan karena Buat Keluarga Jokowi Berantakan,"KOMPAS.com - Sebuah unggahan hadir di media sosial dengan narasi yang menyatakan bahwa Prabowo Subianto dinonaktifkan dari jabatannya sebagai menteri pertahanan.
Unggahan itu menyatakan bahwa Prabowo dinonaktifkan karena membuat keluarga Presiden Joko Widodo berantakan.
Narasi itu muncul dalam keterangan tertulis, serta thumbnail untuk video yang berdurasi 8 menit 16 detik, yang tayang pada 28 November 2023.
Setelah disimak secara detail, tidak ada pernyataan dalam video yang menyatakan bahwa Prabowo dinonaktifkan, atau keluarga Jokowi yang berantakan.
Lalu seperti apa penjelasannya? Bagaimana hoaks itu muncul dan beredar?
Simak infografik berikut ini:
A post shared by Cek Fakta Kompascom (@cekfakta.kompascom)














",CEK FAKTA
Ketahui Penyebab Indikator Oli Motor Terus Menyala,"TANGERANG, KOMPAS.com - Pengendara sepeda motor dianjurkan untuk melakukan ganti oli secara rutin, setidaknya sekali setiap 2.000 kilometer. Langkah perawatan ini berguna untuk memastikan kesehatan mesin dan penggunaan jangka panjang.
Akan tetapi, beberapa pengendara mungkin pernah mengalami kejadian-kejadian membingungkan saat ganti oli. Salah satu contohnya yakni indikator masih menyala.
Untuk diketahui, motor-motor lansiran terbaru biasanya sudah dibekali indikator notifikasi, sebagai pengingat jika oli harus segera diganti.
Kadang-kadang terjadi situasi di mana oli motor sudah diganti, namun indikator tersebut tidak mati, apa penyebabnya?
Flickr/ErFarinder Ganti oli motor secara mandiri di rumah
Anto Hananto, kepala bengkel AHASS 88 Tangerang menjelaskan, kondisi semacam ini memang bisa saja terjadi, dan biasanya disebabkan oleh dua kendala.
Kendala pertama adalah sensor suhu motor rusak dan harus diganti. Komponen ini memang bisa memengaruhi indikator yang terpampang di layar spidometer.
""Biasanya indikator langsung nyala semua, tapi motor enggak apa-apa. Ini masalahnya di sensor, minta ganti,"" ucapnya kepada Kompas.com di Tangerang, Minggu (3/12/2023).
Harga sensor suhu juga tidak terlalu mahal, yakni sekitar Rp 30.000 di bengkel resmi. Proses pemasangan dan servisnya juga terbilang ringkas.
Dok. AHM Ilustrasi kuras mesin motor
Selain sensor, ada satu sebab lain yang membuat indikator tetap menyala walaupun oli sudah diganti, yakni karena kelalaian mekanik lupa melakukan reset.
“Mekaniknya lupa reset habis ganti oli, itu jadi nyala lagi,” ucap Anto.
Anto menjelaskan, indikator oli motor ternyata menggunakan kalkulasi berdasarkan jarak tempuh, untuk menentukan kapan waktu penggantian selanjutnya.
Setelah jarak tempuh penggantian tercapai, indikator akan langsung menyala dan menjadi penanda waktunya mengganti oli motor.














",OTOMOTIF
"Terbongkarnya Pengemis Menginap di Hotel Ponorogo, Berawal Temuan Kunci di Tas","Hal itu diketahui setelah petugas mendapati sebuah kunci kamar hotel di dalam tas milik A saat menggelar pemeriksaan.
""Setelah kami cek identitas dan isi tasnya ditemukan sebuah kunci hotel. Identitas pengemis ini asal Kabupaten Jombang, Jawa Timur,"" kata Subiantoro saat dihubungi oleh Kompas.com, Senin (4/12/2023).
Menurut Subiantoro, pengemis itu sudah seminggu tinggal di hotel tengah Kota Ponorogo.
""Jadi dia datang ke Ponorogo naik bus dari Jombang. Hotelnya saja berapa dan berani menginap dan sudah lebih dari sepekan. Hotelnya (tempat menginap) berada di tengah kota. Jadi hotelnya bukan hotel melati yang ecek-ecek,” kata Subiantoro.
Setiapnya hari, lanjut Subiantoro, pengemis itu beraksi di Alun-Alun Kota Ponorogo lantaran banyaknya wahana hiburan di tempat tersebut. 
A membawa kardus kotak lalu ditulisi ""Mohon Bantuan Dana Untuk Penyandang Disabilitas dan Anak-Anak Tuna Rungu"".
 Tak hanya itu, saat dimintai keterangan, pengemis itu rupanya seorang tunawicara. Ia memilih tinggal di hotel lantaran baru pertama kali mengemis di Kota Ponorogo.

 Subiantoro menduga dari hasil mengemis, perempuan itu mendapatkan penghasilan ratusan ribu rupiah. Pasalnya untuk tinggal di hotel butuh biaya yang tidak sedikit. 
 Terlebih hotel yang ditinggali pengemis itu berada di tengah Kota Ponorogo. 
 ""Dan dia sudah seminggu menginap di sini,"" jelas Subiantoro.
Menyikapi hal tersebut, Satpol PP akan sering menggelar razia pengemis di Kota Ponorogo.














",REGIONAL
"IHSG Diprediksi Menguat di Awal Pekan, Ini Rekomendasi Sahamnya","JAKARTA, KOMPAS.com – Indeks Harga Saham Gabungan (IHSG) diproyeksikan akan menguat pada Senin (4/12/2023).
Sebelumnya, IHSG pada penutupan Jumat (1/12/2023) berakhir di zona hijau pada level 7.059,9 atau melemah 0,29 persen (20,8 poin).
Associate Director of Research and Investment Pilarmas Investindo Maximilianus Nico Demus mengatakan, IHSG hari ini berpeluang menguat. Dia bilang, Indeks manufaktur Indonesia masih berada pada zona ekspansi serta inflasi masih terjaga di ambang batas Bank Indonesia, tentunya dua hal ini akan memberikan katalis positif untuk IHSG. 
SHUTTERSTOCK/SHUTTER_O Ilustrasi saham, pergerakan saham, IHSG.
“Berdasarkan analisa teknikal, kami melihat IHSG berpotensi menguat terbatas dengan support dan resistance di level 7.050 sampai 7.090,” kata Maximilianus dalam analisisnya.
Maximilianus mengun mengatakan, Bank Indonesia terus mencermati sejumlah risiko yang dapat menimbulkan tekanan terhadap tetap terkendalinya inflasi.
Ini termasuk dampak kenaikan harga energi dan pangan global serta tekanan depresiasi nilai tukar rupiah terhadap imported inflation. 
“Untuk itu, Bank Indonesia terus memperkuat bauran kebijakan moneter dan mempererat sinergi dengan pemerintah (pusat dan daerah) untuk memastikan inflasi tetap terkendali dalam kisaran 3 plus minus 1 persen pada 2023 dan 2,5 plus minus 1 persen pada 2024,” lanjut dia.
 Dari luar negeri, pidato pimpinan bank sentral AS Jerome Powell di Spelman College pada hari Jumat kemarin, masih memberikan peringatan bahwa masih terlalu dini untuk menyimpulkan dengan yakin bahwa kebijakan moneter yang ada saat ini telah bersikap membatasi.














",MONEY
 OIKN Luncurkan Nusantara Net Zero Strategy 2045 di COP28,"Kepala OIKN Bambang Susantono menuturkan, peluncuran peta jalan ini menjadi momen bersejarah. Hal ini karena untuk pertama kali kota di Indonesia memiliki RLDC, Regionally and Locally Determined Contribution.
""OIKN dengan bangga mengumumkan Nusantara's Net Zero Emission Strategy, sebuah dokumen yang menunjukkan komitmen kota ini untuk ikut ambil bagian dalam upaya global mengakselerasi aksi iklim,"" ujar Bambang, dalam peluncuran di Paviliun ADB COP28 di Dubai, Uni Emirat Arab, Minggu (3/12/2023).
Bambang menekankan ibu kota baru Indonesia tidak hanya akan menjadi kota yang hijau tapi juga akan menjadi model untuk masa depan yang berkelanjutan.
Terlihat dari target ambisius untuk menjadi kota dengan nol emisi karbon atau net zero emission (NZE), kondisi di mana karbon yang dihasilkan sama dengan kapasitas penyimpanan atau bahkan kurang dari itu.
Beberapa langkah yang akan dilakukan termasuk proses reforestasi secara masif, peremajaan dan menjaga ekologi di Nusantara. Salah satunya dengan mengkonversi 65 persen area Nusantara, yang mayoritas ditutupi tanaman monokultur, menjadi hutan tropis yang asri.
Sementara itu, di area urban akan memanfaatkan teknologi untuk memastikan manajemen sumber daya alam yang efisien sembari menerapkan inovasi solusi berbasis alam.
Contohnya menjadikan Nusantara sebagai kota spons, memastikan ketersediaan air, pengurangan bahaya banjir, serta pelestarian ekologi.
Langkah itu sejalan dengan target Indonesia dalam pengurangan emisi sampai dengan 2060.
""Dalam kolaborasi dengan berbagai pemangku kepentingan, Otorita Ibu Kota Nusantara menyiapkan langkah untuk mentransformasi target ambisius menjadi aksi yang spesifik dan terukur,"" tegas Bambang.
Artikel ini merupakan bagian dari Lestari KG Media, sebuah inisiatif untuk akselerasi Tujuan Pembangunan Berkelanjutan.













",LESTARI
"Wanita Lebih Tertarik dengan Pria Atletis, Benarkah?","KOMPAS.com - Pertanyaan seputar daya tarik antara wanita dan pria sering kali menjadi topik pembahasan menarik. Salah satu stereotip yang umumnya muncul adalah bahwa wanita cenderung lebih tertarik pada pria yang berolahraga atau memiliki badan yang atletis.
Namun, apakah ini benar dan apa alasan wanita lebih menyukai pria yang berolahraga?
Ini menjadi penelitian khusus yang dilakukan oleh tim peneliti Kanada dan diterbitkan dalam jurnal Evolutionary Psychology pada tahun 2010.
Para ahli memiliki suatu hipotesis yang menyatakan, wanita cenderung tertarik pada pria atletis karena mereka menginginkan pasangan yang sehat.
Atlet, selain menunjukkan kesehatan, juga mencerminkan motivasi, kekuatan, tekad, dan kemampuan bekerja sama dalam tim.
Lebih lanjut, prinsip ""efek halo"" menyebabkan persepsi bahwa pria yang sukses dalam bidang olahraga juga cenderung memiliki kualitas positif di berbagai bidang lainnya.
Para peneliti secara spesifik tertarik pada perbandingan antara olahraga tim dan olahraga perseorangan.
Mereka ingin mengetahui apakah pria yang bermain dalam tim lebih menarik, karena hal tersebut menunjukkan kemampuan untuk berkolaborasi dan bekerja sama dengan orang lain.
Sebuah penelitian dilakukan di sebuah universitas di Kanada dengan melibatkan 125 wanita dan 119 pria berusia 18-25 tahun dan berasal dari berbagai latar belakang ilmu pengetahuan.
Dalam sebuah penelitian kecil sebelumnya, orang-orang menilai sekelompok foto wajah lawan jenis yang tidak tersenyum. Foto dengan nilai tertinggi dan terendah dipilih untuk studi yang lebih besar.














",LIFESTYLE
"Berkaca dari Kasus di Ngawi, Mengapa Rumah Bisa Tersambar Petir meski Penghuni Tak Menyalakan TV?","Akibat sambaran itu, rumah menjadi porak-poranda dan sejumlah penghuninya harus dilarikan ke rumah sakit.
Menurut pengakuan kakak korban yang bernama Tohari, adiknya bersama keluarga sedang tidak menyalakan televisi dan ponsel pada saat kejadian.
“Lukanya seperti baret, seperti kalau kulit kena kembang api, ada luka bakar kecil kecil. Beruntung kondisinya tidak parah, hanya syok,"" ungkap Tohari, dikutip dari Kompas.com, Minggu (3/12/2023).

Lantas, mengapa petir bisa menyambar rumah?
Dosen Teknik Ketenagalistrikan Sekolah Teknik Elektro dan Informatika (STEI) Institut Teknologi Bandung (ITB) Syarif Hidayat mengatakan, rumah yang tersambar petir umumnya cukup terpencil dan terpisah dari rumah lain.
“Kira-kira 30-40 meter dari rumah lain. Kalau rumahnya rapat, anggapannya bisa saling melindungi,” kata Syarif saat dihubungi Kompas.com, Minggu (3/12/2023).
Selain itu, rumah yang menonjol, baik di atas bukit atau tempat terbuka, juga lebih memungkinkan tersambar petir.
“Intinya, petir akan menyambar apa saja objek di muka Bumi, rumah, orang, struktur apa pun yang menonjol,” terang dia.
Meski suatu rumahnya sudah berdekatan dengan yang lain, Syarif mengungkapkan masih adanya kemungkinan tersambar petir.
Hal ini terjadi ketika salah satu di antara rumah itu lebih tinggi dari yang lain.
Syarif menegaskan, rumah dengan kondisi di atas berpotensi tersambar petir, meskipun penghuni tidak menyalakan televisi dan bermain ponsel.
“Itu tidak ada urusannya (menyalakan TV dan bermain ponsel). Itu urusannya rumah menonjol dan sekelilingnya tidak ada yang lebih tinggi,” terangnya.
Menurutnya, cara mencegah petir agar tidak menyambar rumah adalah memasang penangkal petir.
“Cara mencegahnya harus dipasang penangkal petir, sebatang logam yang dipasang lebih tinggi dari rumah yang ingin dilindungi,” kata dia.
Dengan begitu, petir nantinya akan menyambar penangkal petir yang sudah terpasang di rumah.
“Jadi, penangkal petir itu adalah objek yang disediakan untuk disambar petir,"" ujarnya.
Lebih lanjut, Syarif menjelaskan bahwa sambaran petir bisa menyebabkan kematian pada satu orang atau lebih sekaligus.
“Petir itu mengandung muatan arus listrik sangat besar, yang cukup membunuh satu orang atau lebih dalam satu waktu,” jelasnya.














",TREN
Ke Mana Para Investor Belanja Hotel?,"Hal ini sekaligus merupakan indikasi tingginya minat investor di tengah pemulihan pariwisata.
Ketiga negara tersebut secara kolektif menyumbang 86 persen aktivitas investasi hotel di kawasan Asia Pasifik. 
“China dan Jepang secara konsisten menjadi pasar yang paling likuid karena skalanya yang besar dan aktivitas pasarnya yang luas,” kata CEO Asia Pasifik JLL Hotels & Hospitality Group Nihat Ercan.
Di Jepang, daya tarik investor meningkat, didorong oleh beberapa faktor termasuk lemahnya yen dan kondisi pembiayaan yang lebih baik dibandingkan dengan destinasi regional lainnya.
Salah satu transaksi penting adalah penjualan Hyatt Regency Tokyo senilai 460 juta dollar AS kepada dana investasi KKR dan Gaw Capital Partners pada bulan Maret 2023, yang tetap menjadi transaksi aset tunggal teratas di Asia Pasifik tahun ini.
Namun, meskipun Jepang merupakan negara asing dengan volume yang lebih tinggi, aktivitas investasi hotel secara keseluruhan masih terus menghadapi hambatan pada tahun yang ditandai dengan tingginya suku bunga dan tekanan inflasi.
Volume investasi di Asia Pasifik mencapai 5,9 miliar dolar AS dalam sembilan bulan pertama tahun ini, turun 40 persen dibandingkan periode yang sama tahun lalu. Jumlah ini menyumbang hampir seperlima dari volume investasi hotel global.
Hotel mewah unggul
Sementara Korea Selatan telah mengalami peningkatan signifikan dalam kinerja penjualan yang dipimpin oleh segmen hotel mewah.














",PROPERTI
[POPULER JABODETABEK] Gibran Bantah Kampanye di CFD Jakarta | Video Viral Wanita Bobol Rumah Kos di Mampang,"JAKARTA, KOMPAS.com - Berita tentang Calon wakil presiden nomor urut 2 Gibran Rakabuming Raka hadir di lokasi car free day (CFD) Jakarta banyak dibaca pada Minggu (3/12/2023).
Video viral seorang wanita membobol sejumlah kamar kos di Gang PLO, di Mampang Prapatan, Jakarta Selatan juga disorot pembaca.
Kekecewaan warga Cililitan mengalami krisis air karena layanan Perumda Air Minum Jaya (PAM JAYA) bermasalah juga jadi berita terpopuler. Berikut paparannya:
Calon wakil presiden nomor urut 2 Gibran Rakabuming Raka membantah berkampanye di lokasi car free day (CFD) di Bundaran HI, Jalan MH Thamrin, Jakarta Pusat, Minggu (3/12/2023).
""Kan tanpa alat peraga kampanye (APK). Kami kan enggak mengajak untuk mencoblos,"" celetuk Gibran kepada awak media di kawasan Bundaran HI.
Gibran mengaku hanya membagikan susu di lokasi car free day (CFD) karena ada banyak warga di sana. Baca selengkapnya di sini.
Video viral di media sosial memperlihatkan seorang wanita membobol sejumlah kamar kos di Gang PLO, Tegal Parang, Mampang Prapatan, Jakarta Selatan.
Video rekaman kamera CCTV itu diunggah di akun Instagram @updateinfojakarta.
Dalam video terlihat wanita itu memakai masker hitam, kemeja berwarna abu-abu, serta celana krem.Baca selengkapnya di sini.
Sudah sekitar satu bulan warga RT 002/RW 14, Cililitan, Kramatjati, Jakarta Timur, mengalami krisis air karena layanan Perumda Air Minum Jaya (PAM JAYA) bermasalah.
Air PAM di wilayah itu sudah mati selama sekitar satu bulan. Air yang tadinya mengalir deras langsung mengecil sampai saat ini.
Warga bernama Mentari (30) mengaku tidak mengetahui apa penyebabnya. Di RT tersebut, ada sekitar 15 keluarga lainnya yang air PAM-nya juga bermasalah. Baca selengkapnya di sini.














",NEWS
Abuya Muhtadi Disebut Dukung Ganjar-Mahfud dan Gabung TPN Jadi Dewan Penasihat,"Abuya Muhtadi juga bersedia menjadi Dewan Penasihat Tim Pemenangan Nasional (TPN) Ganjar-Mahfud.
Hal itu disampaikan oleh Dewan Penasihat TPN Yenny Wahid usai melakukan pertemuan tertutup dengan Abuya Muhtadi di Gedung High End, Jakarta Pusat, Minggu (3/12/2023).
""Abuya Muhtadi sudah menyatakan bersedia untuk duduk menjadi salah satu, menjadi dewan penasihat. Jadi beliau berkenan untuk menemani kami kami semua, yang sedang berjuang,"" kata Yenny dalam konferensi pers di Gedung High End, Jakarta Pusat, Minggu malam.
Yenny juga mengklaim bahwa sebelum Abuya Muhtadi datang ke High End, suara dukungan para kiai di Banten untuk Ganjar-Mahfud sudah dilakukan.
Menurutnya, dukungan dari Abuya Muhtadi serta para ulama itu memberikan semangat besar bagi TPN Ganjar-Mahfud.
""Dan pastinya di sini ada murid-murid beliau (Abuya Muhtadi) yang siap bergerak memenangkan pasangan Ganjar-Mahfud,"" ujar putri Presiden ke-4 RI, Abdurrahman Wahid ini.
Sebagai informasi, Yenny Wahid didampingi oleh Wakil Ketua TPN Ganjar-Mahfud, Jenderal TNI (Purn) Andika Perkasa saat menerima silaturahim Abuya Muhtadi.
Kemudian, berlangsung pertemuan tertutup lebih kurang selama 1 jam 30 menit.
Setelah konferensi pers usai pertemuan, Abuya Muhtadi ikut berpose tiga jari bersama Yenny Wahid dan Andika Perkasa.
Adapun angka tiga adalah nomor urut pasangan capres-cawapres, Ganjar-Mahfud pada pemilihan presiden (Pilpres) 2024.
Sementara itu, capres nomor urut 2, Prabowo Subianto diketahui berkunjung ke Pondok Pesantren (ponpes) Roudatul Ulum Cidahu, Kabupaten Pandeglang, Banten, pada hari yang sama, Minggu (3/11/2023).
Pantauan Kompas.com di lokasi, Prabowo langsung disambut oleh Abuya Murtadho, ratusan santri ponpes, serta para ibu yang sudah menunggu.
Usai pertemuan tertutup, Abuya Murtadho mengatakan, dirinya memberikan nasihat dan mendoakan agar Prabowo jadi Presiden ke-8 RI.
""Jadi jangan hanya dijadikan semboyan, karena itu adalah jati diri anak bangsa. Insya Allah kalau kembali ke UUD 1945 dan Pancasila termasuk mensejahterakan rakyatnya akan berhasil,"" kata Abuya Murtadho.
""Kemudian, tadi saya juga berdoa, semoga Prabowo dijadikan Presiden ke-8, dijadikan imam untuk Indonesia dari hari ini ke depan. Langsung diaminin beliau dan kami sekeluarga,"" ujarnya lagi.














",NEWS
